基因之楔,基因之楔,能让合体后的酋雷姆和某宝可梦分离成原状的一对楔子。,能讓合體後的酋雷姆和某寶可夢分離至原狀的一對楔子。,能讓合體後的酋雷姆和某寶可夢分離成原狀的一對楔子。
许可证,許可證,只有极少数人才知道的，进入自然保护区所需的授权卡。,進入只有極少數人才知道的自然保護區時，所需的授權卡。,只有極少數人才知道的，進入自然保護區所需的授權卡。
圆形护符,圓形護符,拥有它之后，在寄放屋里会更容易找到蛋的神奇浑圆护符。,只要擁有它，便會變得更容易在寄放屋裡發現蛋的神奇渾圓護符。,擁有它之後，在寄放屋裡會更容易找到蛋的神奇渾圓護符。
闪耀护符,閃耀護符,拥有它之后，据说会更容易遇见发光宝可梦的神奇闪光护符。,只要擁有它，據說會變得更容易遇見發光寶可夢的神奇閃光護符。,擁有它之後，據說會更容易遇見發光寶可夢的神奇閃光護符。
等离子卡,等離子卡,在等离子驱逐舰的船内输入密码时，需要用到的钥匙卡。,在等離子驅逐艦的船內輸入密碼時，需要用到的鑰匙卡。,在等離子驅逐艦的船內輸入密碼時，需要用到的鑰匙卡。
脏手帕,髒手帕,七宝市仓库咖啡馆的熟客遗失的手帕。隐约有着宝可梦的香气。,七寶市倉庫咖啡館的熟客遺失的手帕。隱約有著寶可夢的香氣。,七寶市倉庫咖啡館的熟客遺失的手帕。隱約有著寶可夢的香氣。
阿克罗玛机器,阿克羅瑪機器,能强行让宝可梦的能力觉醒的特殊装置。但由于是试制品，功能尚未完善。,能強行讓寶可夢的能力覺醒的特殊裝置。但由於是試作品，功能還不完全。,能強行讓寶可夢的能力覺醒的特殊裝置。但由於是試製品，功能尚未完善。
遗忘物,遺忘物,在雷文市的游乐园里捡到的即时通讯器。失主好像是个男孩子。,在雷文市的遊樂園裡撿到的即時通訊器。失主好像是個男孩子。,在雷文市的遊樂園裡撿到的即時通訊器。失主好像是個男孩子。
遗忘物,遺忘物,在雷文市的游乐园里捡到的即时通讯器。失主好像是个女孩子。,在雷文市的遊樂園裡撿到的即時通訊器。失主好像是個女孩子。,在雷文市的遊樂園裡撿到的即時通訊器。失主好像是個女孩子。
现形镜,現形鏡,能够通过照出真实，让宝可梦变回原来样子的神奇镜子。,能藉由照出真實，讓寶可夢變回原來樣子的神奇鏡子。,能夠通過照出真實，讓寶可夢變回原來樣子的神奇鏡子。
弱点保险,弱點保險,被针对弱点时，攻击和特攻就会大幅提高。,被攻擊到弱點時，攻擊和特攻就會分別大幅提高。,被針對弱點時，攻擊和特攻就會大幅提高。
突击背心,突擊背心,会变得富有攻击性的背心。虽然携带后特防会提高，但会无法使出变化招式。,會變得富有攻擊性的背心。雖然攜帶後特防會提高，但會無法使出變化招式。,會變得富有攻擊性的背心。雖然攜帶後特防會提高，但會無法使出變化招式。
全息影像通讯器,全像投影通訊器,可以随时查看接收到的全息影像数据的装置。,可以隨時查看接收到的全像投影資料的裝置。,可以隨時查看接收到的全像投影資料的裝置。
博士的信,博士的信,布拉塔诺博士写给妈妈的信。上面带有微微的香气。,布拉塔諾博士寫給媽媽的信。信上帶有微微香氣。,布拉塔諾博士寫給媽媽的信。上面帶有微微的香氣。
轮滑鞋,溜冰鞋,鞋底下装着滑轮。能在地面上滑行，或漂亮地表演特技。,鞋底裝著滑輪。能在地面上滑行，或漂亮地表演特技。,鞋底下裝著滑輪。能在地面上滑行，或漂亮地表演特技。
妖精石板,妖精石板,妖精属性的石板。携带后，妖精属性的招式威力就会增强。,妖精屬性的石板。攜帶後，妖精屬性的招式威力就會增強。,妖精屬性的石板。攜帶後，妖精屬性的招式威力就會增強。
特性胶囊,特性膠囊,如果用于有着２种特性的宝可梦，就能令其现有特性变为另一种的胶囊。,如果用於有著２種特性的寶可夢，就能使其特性變為另外一種的膠囊。,如果用於有著２種特性的寶可夢，就能令其現有特性變為另一種的膠囊。
泡沫奶油,泡沫奶油,松松软软起着泡的，稍微有点甜的奶油。某种宝可梦很喜欢它。,鬆鬆軟軟起著泡的，稍微有點甜的奶油。某種寶可夢很喜歡它。,松鬆軟軟起著泡的，稍微有點甜的奶油。某種寶可夢很喜歡它。
香袋,香袋,装着散发微浓香气的香料的袋子。某种宝可梦很喜欢它。,裝著散發有點濃的香氣的香料的袋子。某種寶可夢很喜歡它。,裝著散發微濃香氣的香料的袋子。某種寶可夢很喜歡它。
光苔,光苔,一次性使用的光苔。携带它的宝可梦如果受到水属性招式攻击，特防就会提高。,只能使用一次的光苔。攜帶它的寶可夢如果受到水屬性招式攻擊，特防就會提高。,一次性使用的光苔。攜帶它的寶可夢如果受到水屬性招式攻擊，特防就會提高。
雪球,雪球,一次性使用的雪球。携带它的宝可梦如果受到冰属性招式攻击，攻击就会提高。,只能使用一次的雪球。攜帶它的寶可夢如果受到冰屬性招式攻擊，攻擊就會提高。,一次性使用的雪球。攜帶它的寶可夢如果受到冰屬性招式攻擊，攻擊就會提高。
防尘护目镜,防塵護目鏡,不单是天气造成的伤害，就连粉末类招式的效果也能防御的护目镜。,不單是天氣造成的傷害，連放出粉末的招式效果也能防止的護目鏡。,不單是天氣造成的傷害，就連粉末類招式的效果也能防禦的護目鏡。
宝可梦之笛,寶可夢之笛,能吹出让睡着的宝可梦都会情不自禁醒来的美妙音色的笛子。,能吹出讓睡著的寶可夢都會情不自禁醒來的美妙音色的笛子。,能吹出讓睡著的寶可夢都會情不自禁醒來的美妙音色的笛子。
硕果肥,碩果肥,培育树果时的肥料。但完全不适合丰缘地区的土壤，所以没什么效果。,培育樹果時的肥料。但完全不適合豐緣地區的土壤，所以沒什麼效果。,培育樹果時的肥料。但完全不適合豐緣地區的土壤，所以沒什麼效果。
吃惊肥,吃驚肥,培育树果时的肥料。但完全不适合丰缘地区的土壤，所以没什么效果。,培育樹果時的肥料。但完全不適合豐緣地區的土壤，所以沒什麼效果。,培育樹果時的肥料。但完全不適合豐緣地區的土壤，所以沒什麼效果。
劲劲肥,勁勁肥,培育树果时的肥料。但完全不适合丰缘地区的土壤，所以没什么效果。,培育樹果時的肥料。但完全不適合豐緣地區的土壤，所以沒什麼效果。,培育樹果時的肥料。但完全不適合豐緣地區的土壤，所以沒什麼效果。
超效肥,超效肥,培育树果时的肥料。但完全不适合丰缘地区的土壤，所以没什么效果。,培育樹果時的肥料。但完全不適合豐緣地區的土壤，所以沒什麼效果。,培育樹果時的肥料。但完全不適合豐緣地區的土壤，所以沒什麼效果。
耿鬼进化石,耿鬼進化石,让耿鬼携带后，在战斗时就能进行超级进化的一种神奇超级石。,讓耿鬼攜帶後，在戰鬥時就能進行超級進化的一種神奇超級石。,讓耿鬼攜帶後，在戰鬥時就能進行超級進化的一種神奇超級石。
沙奈朵进化石,沙奈朵進化石,让沙奈朵携带后，在战斗时就能进行超级进化的一种神奇超级石。,讓沙奈朵攜帶後，在戰鬥時就能進行超級進化的一種神奇超級石。,讓沙奈朵攜帶後，在戰鬥時就能進行超級進化的一種神奇超級石。
电龙进化石,電龍進化石,让电龙携带后，在战斗时就能进行超级进化的一种神奇超级石。,讓電龍攜帶後，在戰鬥時就能進行超級進化的一種神奇超級石。,讓電龍攜帶後，在戰鬥時就能進行超級進化的一種神奇超級石。
妙蛙花进化石,妙蛙花進化石,让妙蛙花携带后，在战斗时就能进行超级进化的一种神奇超级石。,讓妙蛙花攜帶後，在戰鬥時就能進行超級進化的一種神奇超級石。,讓妙蛙花攜帶後，在戰鬥時就能進行超級進化的一種神奇超級石。
喷火龙进化石Ｘ,噴火龍進化石Ｘ,让喷火龙携带后，在战斗时就能进行超级进化的一种神奇超级石。,讓噴火龍攜帶後，在戰鬥時就能進行超級進化的一種神奇超級石。,讓噴火龍攜帶後，在戰鬥時就能進行超級進化的一種神奇超級石。
水箭龟进化石,水箭龜進化石,让水箭龟携带后，在战斗时就能进行超级进化的一种神奇超级石。,讓水箭龜攜帶後，在戰鬥時就能進行超級進化的一種神奇超級石。,讓水箭龜攜帶後，在戰鬥時就能進行超級進化的一種神奇超級石。
超梦进化石Ｘ,超夢進化石Ｘ,让超梦携带后，在战斗时就能进行超级进化的一种神奇超级石。,讓超夢攜帶後，在戰鬥時就能進行超級進化的一種神奇超級石。,讓超夢攜帶後，在戰鬥時就能進行超級進化的一種神奇超級石。
超梦进化石Ｙ,超夢進化石Ｙ,让超梦携带后，在战斗时就能进行超级进化的一种神奇超级石。,讓超夢攜帶後，在戰鬥時就能進行超級進化的一種神奇超級石。,讓超夢攜帶後，在戰鬥時就能進行超級進化的一種神奇超級石。
火焰鸡进化石,火焰雞進化石,让火焰鸡携带后，在战斗时就能进行超级进化的一种神奇超级石。,讓火焰雞攜帶後，在戰鬥時就能進行超級進化的一種神奇超級石。,讓火焰雞攜帶後，在戰鬥時就能進行超級進化的一種神奇超級石。
恰雷姆进化石,恰雷姆進化石,让恰雷姆携带后，在战斗时就能进行超级进化的一种神奇超级石。,讓恰雷姆攜帶後，在戰鬥時就能進行超級進化的一種神奇超級石。,讓恰雷姆攜帶後，在戰鬥時就能進行超級進化的一種神奇超級石。
黑鲁加进化石,黑魯加進化石,让黑鲁加携带后，在战斗时就能进行超级进化的一种神奇超级石。,讓黑魯加攜帶後，在戰鬥時就能進行超級進化的一種神奇超級石。,讓黑魯加攜帶後，在戰鬥時就能進行超級進化的一種神奇超級石。
波士可多拉进化石,波士可多拉進化石,让波士可多拉携带后，在战斗时就能进行超级进化的一种神奇超级石。,讓波士可多拉攜帶後，在戰鬥時就能進行超級進化的一種神奇超級石。,讓波士可多拉攜帶後，在戰鬥時就能進行超級進化的一種神奇超級石。
诅咒娃娃进化石,詛咒娃娃進化石,让诅咒娃娃携带后，在战斗时就能进行超级进化的一种神奇超级石。,讓詛咒娃娃攜帶後，在戰鬥時就能進行超級進化的一種神奇超級石。,讓詛咒娃娃攜帶後，在戰鬥時就能進行超級進化的一種神奇超級石。
班基拉斯进化石,班基拉斯進化石,让班基拉斯携带后，在战斗时就能进行超级进化的一种神奇超级石。,讓班基拉斯攜帶後，在戰鬥時就能進行超級進化的一種神奇超級石。,讓班基拉斯攜帶後，在戰鬥時就能進行超級進化的一種神奇超級石。
巨钳螳螂进化石,巨鉗螳螂進化石,让巨钳螳螂携带后，在战斗时就能进行超级进化的一种神奇超级石。,讓巨鉗螳螂攜帶後，在戰鬥時就能進行超級進化的一種神奇超級石。,讓巨鉗螳螂攜帶後，在戰鬥時就能進行超級進化的一種神奇超級石。
凯罗斯进化石,凱羅斯進化石,让凯罗斯携带后，在战斗时就能进行超级进化的一种神奇超级石。,讓凱羅斯攜帶後，在戰鬥時就能進行超級進化的一種神奇超級石。,讓凱羅斯攜帶後，在戰鬥時就能進行超級進化的一種神奇超級石。
化石翼龙进化石,化石翼龍進化石,让化石翼龙携带后，在战斗时就能进行超级进化的一种神奇超级石。,讓化石翼龍攜帶後，在戰鬥時就能進行超級進化的一種神奇超級石。,讓化石翼龍攜帶後，在戰鬥時就能進行超級進化的一種神奇超級石。
路卡利欧进化石,路卡利歐進化石,让路卡利欧携带后，在战斗时就能进行超级进化的一种神奇超级石。,讓路卡利歐攜帶後，在戰鬥時就能進行超級進化的一種神奇超級石。,讓路卡利歐攜帶後，在戰鬥時就能進行超級進化的一種神奇超級石。
暴雪王进化石,暴雪王進化石,让暴雪王携带后，在战斗时就能进行超级进化的一种神奇超级石。,讓暴雪王攜帶後，在戰鬥時就能進行超級進化的一種神奇超級石。,讓暴雪王攜帶後，在戰鬥時就能進行超級進化的一種神奇超級石。
袋兽进化石,袋獸進化石,让袋兽携带后，在战斗时就能进行超级进化的一种神奇超级石。,讓袋獸攜帶後，在戰鬥時就能進行超級進化的一種神奇超級石。,讓袋獸攜帶後，在戰鬥時就能進行超級進化的一種神奇超級石。
暴鲤龙进化石,暴鯉龍進化石,让暴鲤龙携带后，在战斗时就能进行超级进化的一种神奇超级石。,讓暴鯉龍攜帶後，在戰鬥時就能進行超級進化的一種神奇超級石。,讓暴鯉龍攜帶後，在戰鬥時就能進行超級進化的一種神奇超級石。
阿勃梭鲁进化石,阿勃梭魯進化石,让阿勃梭鲁携带后，在战斗时就能进行超级进化的一种神奇超级石。,讓阿勃梭魯攜帶後，在戰鬥時就能進行超級進化的一種神奇超級石。,讓阿勃梭魯攜帶後，在戰鬥時就能進行超級進化的一種神奇超級石。
喷火龙进化石Ｙ,噴火龍進化石Ｙ,让喷火龙携带后，在战斗时就能进行超级进化的一种神奇超级石。,讓噴火龍攜帶後，在戰鬥時就能進行超級進化的一種神奇超級石。,讓噴火龍攜帶後，在戰鬥時就能進行超級進化的一種神奇超級石。
胡地进化石,胡地進化石,让胡地携带后，在战斗时就能进行超级进化的一种神奇超级石。,讓胡地攜帶後，在戰鬥時就能進行超級進化的一種神奇超級石。,讓胡地攜帶後，在戰鬥時就能進行超級進化的一種神奇超級石。
赫拉克罗斯进化石,赫拉克羅斯進化石,让赫拉克罗斯携带后，在战斗时就能进行超级进化的一种神奇超级石。,讓赫拉克羅斯攜帶後，在戰鬥時就能進行超級進化的一種神奇超級石。,讓赫拉克羅斯攜帶後，在戰鬥時就能進行超級進化的一種神奇超級石。
大嘴娃进化石,大嘴娃進化石,让大嘴娃携带后，在战斗时就能进行超级进化的一种神奇超级石。,讓大嘴娃攜帶後，在戰鬥時就能進行超級進化的一種神奇超級石。,讓大嘴娃攜帶後，在戰鬥時就能進行超級進化的一種神奇超級石。
雷电兽进化石,雷電獸進化石,让雷电兽携带后，在战斗时就能进行超级进化的一种神奇超级石。,讓雷電獸攜帶後，在戰鬥時就能進行超級進化的一種神奇超級石。,讓雷電獸攜帶後，在戰鬥時就能進行超級進化的一種神奇超級石。
烈咬陆鲨进化石,烈咬陸鯊進化石,让烈咬陆鲨携带后，在战斗时就能进行超级进化的一种神奇超级石。,讓烈咬陸鯊攜帶後，在戰鬥時就能進行超級進化的一種神奇超級石。,讓烈咬陸鯊攜帶後，在戰鬥時就能進行超級進化的一種神奇超級石。
拉帝亚斯进化石,拉帝亞斯進化石,让拉帝亚斯携带后，在战斗时就能进行超级进化的一种神奇超级石。,讓拉帝亞斯攜帶後，在戰鬥時就能進行超級進化的一種神奇超級石。,讓拉帝亞斯攜帶後，在戰鬥時就能進行超級進化的一種神奇超級石。
拉帝欧斯进化石,拉帝歐斯進化石,让拉帝欧斯携带后，在战斗时就能进行超级进化的一种神奇超级石。,讓拉帝歐斯攜帶後，在戰鬥時就能進行超級進化的一種神奇超級石。,讓拉帝歐斯攜帶後，在戰鬥時就能進行超級進化的一種神奇超級石。
洛玫果,洛玫果,让宝可梦携带后，在受到效果绝佳的妖精属性招式攻击时，能令其威力减弱。,讓寶可夢攜帶後，在受到效果絕佳的妖精屬性招式攻擊時，能使其威力減弱。,讓寶可夢攜帶後，在受到效果絕佳的妖精屬性招式攻擊時，能令其威力減弱。
亚开果,亞開果,让宝可梦携带后，在受到物理招式攻击时，自己的防御就会提高。,讓寶可夢攜帶後，在受到物理招式攻擊時，自己的防禦就會提高。,讓寶可夢攜帶後，在受到物理招式攻擊時，自己的防禦就會提高。
香罗果,香羅果,让宝可梦携带后，在受到特殊招式攻击时，自己的特防就会提高。,讓寶可夢攜帶後，在受到特殊招式攻擊時，自己的特防就會提高。,讓寶可夢攜帶後，在受到特殊招式攻擊時，自己的特防就會提高。
莲叶童子喷壶,蓮葉童子噴壺,浇水的道具。能让埋在松软土壤里的树果快快长大。,澆水的器具。能讓埋在鬆軟土壤裡的樹果快快長大。,澆水的道具。能讓埋在鬆軟土壤裡的樹果快快長大。
招式学习器９６,招式學習器９６,用自然之力进行攻击。根据所使用场所的不同，使出的招式也会有所变化。,用自然之力進行攻擊。隨著使用場所的不同，使出的招式也會有所變化。,用自然之力進行攻擊。根據所使用場所的不同，使出的招式也會有所變化。
招式学习器９７,招式學習器９７,从体内发出充满恶意的恐怖气场。有时会使对手畏缩。,從身體發出充滿惡意的恐怖氣場。有時會使對手畏縮。,從體內發出充滿惡意的恐怖氣場。有時會使對手畏縮。
招式学习器９８,招式學習器９８,以惊人的气势扑向对手。有时会使对手畏缩。,以驚人的氣勢撲向對手。有時會讓對手畏縮。,以驚人的氣勢撲向對手。有時會使對手畏縮。
招式学习器９９,招式學習器９９,向对手发出强光，并给予伤害。,向對手發出強光，並給予傷害。,向對手發出強光，並給予傷害。
招式学习器１００,招式學習器１００,和对手进行密语，使其失去集中力，从而降低对手的特攻。,向對手低聲密語，使其失去集中力，進而降低對手的特攻。,和對手進行密語，使其失去集中力，從而降低對手的特攻。
发电厂通行证,發電廠通行證,该通行证可用作进入１３号道路上的发电厂时所需的身份证明。,該通行證可用作進入１３號道路上的發電廠時所需的身份證明。,該通行證可用作進入１３號道路上的發電廠時所需的身份證明。
超级环,超級環,蕴藏着未知力量的圆环。能让携带着超级石战斗的宝可梦进行超级进化。,隱藏著未知力量的圓環。能讓攜帶著超級石戰鬥的寶可夢進行超級進化。,蘊藏著未知力量的圓環。能讓攜帶著超級石戰鬥的寶可夢進行超級進化。
似珍石,似珍石,在有些人看来可能会觉得它十分贵重。非常与众不同的石头。,在某些人眼裡可能會覺得它十分貴重。頗與眾不同的石頭。,在有些人看來可能會覺得它十分貴重。非常與眾不同的石頭。
常见石,常見石,在有些人看来可能会觉得它十分贵重。但其实是块普通的石头。,在某些人眼裡可能會覺得它十分貴重。但其實是塊普通的石頭。,在有些人看來可能會覺得它十分貴重。但其實是塊普通的石頭。
折价券,折價券,在时装店买道具时，能以比平时更低的价格购买的券。,在時裝店買物品時，能以比平時更低的價格購買的券。,在時裝店買道具時，能以比平時更低的價格購買的券。
电梯钥匙,電梯鑰匙,可以启动弗拉达利研究所里电梯的钥匙卡。上面有着闪焰队的标志。,可以啟動弗拉達利研究所裡電梯的鑰匙卡。上面有著閃焰隊的標誌。,可以啟動弗拉達利研究所裡電梯的鑰匙卡。上面有著閃焰隊的標誌。
ＴＭＶ自由票,ＴＭＶ自由票,可以随时乘坐连接着密阿雷市和奇楠市的超高速列车的车票。,可以隨時乘坐連接著密阿雷市和奇楠市的超高速列車的車票。,可以隨時乘坐連接著密阿雷市和奇楠市的超高速列車的車票。
卡洛斯勋章,卡洛斯勳章,颁发给为卡洛斯地区作出杰出贡献的人的宝贵勋章。,頒發給為卡洛斯地區帶來傑出貢獻的人的寶貴勳章。,頒發給為卡洛斯地區作出傑出貢獻的人的寶貴勳章。
探险心得,探險心得,朋友亲手制作的指南手册。里面汇总了训练家在旅行时所需注意的各种事项。,朋友親手製作的指南手冊。裡面整合了訓練家旅行時的注意事項。,朋友親手製作的指南手冊。裡面匯總了訓練家在旅行時所需注意的各種事項。
神秘摆设,神秘擺設,在阿罗拉地区，据说是模仿古时候被称为守护神的神奇宝可梦而制作的摆设。,據說是模仿自古以來在阿羅拉地區被稱為守護神的神奇寶可夢而製作的擺設。,在阿羅拉地區，據說是模仿古時候被稱為守護神的神奇寶可夢而製作的擺設。
隐形眼镜盒,隱形眼鏡盒,可以存放隐形眼镜的，有点漂亮的盒子。,可以存放隱形眼鏡的，有點漂亮的盒子。,可以存放隱形眼鏡的，有點漂亮的盒子。
化妆包,化妝包,可以存放唇膏的精美小包包。,可以存放唇膏的精美小包包。,可以存放唇膏的精美小包包。
衣物箱,衣物箱,能塞入任意时尚物品，收纳能力极佳的轻箱子。,能夠塞入各種時尚物品的收納能力極佳的輕箱子。,能塞入任意時尚物品，收納能力極佳的輕箱子。
密阿雷格雷派饼,密阿雷格雷派餅,在密阿雷市很受欢迎的点心。能治愈１只宝可梦的所有异常状态。,在密阿雷市很受歡迎的點心。能治癒１隻寶可夢的所有異常狀態。,在密阿雷市很受歡迎的點心。能治癒１只寶可夢的所有異常狀態。
娑罗沙布蕾,娑羅沙布蕾,娑罗市特产的沙布蕾。能治愈１只宝可梦的所有异常状态。,娑羅市特產的沙布蕾。能治癒１隻寶可夢的所有異常狀態。,娑羅市特產的沙布蕾。能治癒１只寶可夢的所有異常狀態。
颚之化石,顎之化石,很久以前生活在地上的古代宝可梦的化石。好像是很大的颚的一部分。,很久以前生活在地上的古代寶可夢的化石。好像是很大的顎的一部分。,很久以前生活在地上的古代寶可夢的化石。好像是很大的顎的一部分。
鳍之化石,鰭之化石,很久以前生活在地上的古代宝可梦的化石。好像是头鳍的一部分。,很久以前生活在地上的古代寶可夢的化石。好像是頭鰭的一部分。,很久以前生活在地上的古代寶可夢的化石。好像是頭鰭的一部分。
帅哥券,帥哥券,喷有闪闪发光的涂料，帅哥亲手制作的券。,噴有閃閃發光的塗料，帥哥親手製作的券。,噴有閃閃發光的塗料，帥哥親手製作的券。
自行车,自行車,能比跑步鞋跑得还快的折叠式自行车。,能跑得比跑步鞋還快的折疊式自行車。,能比跑步鞋跑得還快的摺疊式自行車。
全息影像通讯器,全像投影通訊器,可以随时查看接收到的全息影像数据的装置。,可以隨時查看接收到的全像投影資料的裝置。,可以隨時查看接收到的全像投影資料的裝置。
妖精宝石,妖精寶石,妖精属性的宝石。携带后，妖精属性的招式威力会仅增强１次。,妖精屬性的寶石。攜帶後，妖精屬性的招式威力會僅增強１次。,妖精屬性的寶石。攜帶後，妖精屬性的招式威力會僅增強１次。
超级坠饰,超級墜飾,蕴藏着未知力量的坠饰。能让携带着超级石战斗的宝可梦进行超级进化。,隱藏著未知力量的墜飾。能讓攜帶著超級石戰鬥的寶可夢進行超級進化。,蘊藏著未知力量的墜飾。能讓攜帶著超級石戰鬥的寶可夢進行超級進化。
超级手套,超級手套,蕴藏着未知力量的手套。能让携带着超级石战斗的宝可梦进行超级进化。,隱藏著未知力量的手套。能讓攜帶著超級石戰鬥的寶可夢進行超級進化。,蘊藏著未知力量的手套。能讓攜帶著超級石戰鬥的寶可夢進行超級進化。
音速自行车,音速自行車,能以２倍以上的速度移动的折叠式自行车。,能以２倍以上速度移動的折疊式自行車。,能以２倍以上的速度移動的摺疊式自行車。
越野自行车,越野自行車,能做出跳跃或抬前轮动作的折叠式自行车。,能做出跳躍或抬前輪動作的折疊式自行車。,能做出跳躍或抬前輪動作的摺疊式自行車。
吼吼鲸喷壶,吼吼鯨噴壺,浇水的道具。能让埋在土壤里的树果快快长大。,澆水的器具。能讓埋在土壤裡的樹果快快長大。,澆水的道具。能讓埋在土壤裡的樹果快快長大。
