招式学习器６９,招式學習器６９,打磨自己的身体，减少空气阻力。可以大幅提高自己的速度。,打磨自己的身體，減少空氣阻力。可大幅提高自己的速度。,打磨自己的身體，減少空氣阻力。可以大幅提高自己的速度。
招式学习器７０,招式學習器７０,在５回合内减弱物理和特殊的伤害。只有冰雹时才能使出。,在５回合內減弱物理和特殊的傷害。在下冰雹時才有效果。,在５回合內減弱物理和特殊的傷害。只有冰雹時才能使出。
招式学习器７１,招式學習器７１,用尖尖的岩石刺入对手进行攻击。容易击中要害。,用尖銳的岩石刺進對手進行攻擊。容易擊中要害。,用尖尖的岩石刺入對手進行攻擊。容易擊中要害。
招式学习器７２,招式學習器７２,在攻击之后急速返回，和后备宝可梦进行替换。,攻擊後迅速返回，和後備寶可夢進行替換。,在攻擊之後急速返回，和後備寶可夢進行替換。
招式学习器７３,招式學習器７３,向对手发出微弱的电击，从而让对手陷入麻痹状态。,放出微弱的電流。讓對手陷入麻痺狀態。,向對手發出微弱的電擊，從而讓對手陷入麻痺狀態。
招式学习器７４,招式學習器７４,让身体高速旋转并撞击对手。速度比对手越慢，威力越大。,高速旋轉身體，撞擊對手。速度比對手越慢，威力越大。,讓身體高速旋轉並撞擊對手。速度比對手越慢，威力越大。
招式学习器７５,招式學習器７５,激烈地跳起战舞提高气势。大幅提高自己的攻击。,激烈地跳起戰舞提升氣勢。大幅提高自己的攻擊。,激烈地跳起戰舞提高氣勢。大幅提高自己的攻擊。
招式学习器７６,招式學習器７６,第１回合飞上天空，第２回合攻击对手。,使用後的第１回合飛上天空，並於第２回合攻擊對手。,第１回合飛上天空，第２回合攻擊對手。
招式学习器７７,招式學習器７７,向自己施以自我暗示，将能力变化的状态变得和对手一样。,向自己施加自我暗示，讓能力變化的狀態變得與對手相同。,向自己施以自我暗示，將能力變化的狀態變得和對手一樣。
招式学习器７８,招式學習器７８,用力踩踏地面并攻击自己周围所有的宝可梦。降低对方的速度。,用力踩踏地面，攻擊自己周圍所有的寶可夢。可降低對手的速度。,用力踩踏地面並攻擊自己周圍所有的寶可夢。降低對方的速度。
招式学习器７９,招式學習器７９,将冰冷的气息吹向对手进行攻击。必定会击中要害。,將冰冷的氣息吹向對手進行攻擊。必定會擊中要害。,將冰冷的氣息吹向對手進行攻擊。必定會擊中要害。
招式学习器８０,招式學習器８０,将大岩石猛烈地撞向对手进行攻击。有时会使对手畏缩。,將大岩石猛烈地砸向對手進行攻擊。有時會讓對手畏縮。,將大岩石猛烈地撞向對手進行攻擊。有時會使對手畏縮。
招式学习器８１,招式學習器８１,将镰刀或爪子像剪刀般地交叉，顺势劈开对手。,將鐮刀或爪子像剪刀般地交叉，順勢劈開對手。,將鐮刀或爪子像剪刀般地交叉，順勢劈開對手。
招式学习器８２,招式學習器８２,弹飞对手，强制拉后备宝可梦上场。如果对手为野生宝可梦，战斗将直接结束。,彈飛對手，強制讓後備寶可夢上場。對手為野生寶可夢時，戰鬥將直接結束。,彈飛對手，強制拉後備寶可夢上場。如果對手為野生寶可夢，戰鬥將直接結束。
招式学习器８３,招式學習器８３,在４～５回合内死缠烂打地进行攻击。在此期间对手将无法逃走。,在４～５回合內死纏爛打地進行攻擊。在此期間對手將無法逃走。,在４～５回合內死纏爛打地進行攻擊。在此期間對手將無法逃走。
招式学习器８４,招式學習器８４,用带毒的触手或手臂刺入对手。有时会让对手陷入中毒状态。,以帶有毒性的觸手或手臂刺進對手。有時會讓對手陷入中毒狀態。,用帶毒的觸手或手臂刺入對手。有時會讓對手陷入中毒狀態。
招式学习器８５,招式學習器８５,吃掉正在睡觉的对手的梦进行攻击。回复对手所受到伤害的一半ＨＰ。,吃掉熟睡中對手的夢進行攻擊。可以回復給予對手傷害的一半ＨＰ。,吃掉正在睡覺的對手的夢進行攻擊。回復對手所受到傷害的一半ＨＰ。
招式学习器８６,招式學習器８６,用草缠住并绊倒对手。对手越重，威力越大。,用打結的草絆倒對手。對手越重，威力越大。,用草纏住並絆倒對手。對手越重，威力越大。
招式学习器８７,招式學習器８７,激怒对手，使其混乱。因为愤怒，对手的攻击会大幅提高。,讓對手火大並陷入混亂。但對手的攻擊會因憤怒而大幅提高。,激怒對手，使其混亂。因為憤怒，對手的攻擊會大幅提高。
招式学习器８８,招式學習器８８,从自己已学会的招式中任意使出１个。只能在自己睡觉时使用。,從自己已學會的招式中隨機選出１個使出。只有在睡眠狀態時可以使用。,從自己已學會的招式中任意使出１個。只能在自己睡覺時使用。
招式学习器８９,招式學習器８９,在攻击之后急速返回，和后备宝可梦进行替换。,攻擊後迅速返回，和後備寶可夢進行替換。,在攻擊之後急速返回，和後備寶可夢進行替換。
招式学习器９０,招式學習器９０,削减少许自己的ＨＰ，制造分身。分身将成为自己的替身。,消耗一些自己的ＨＰ，製造分身。分身將成為自己的替身。,削減少許自己的ＨＰ，製造分身。分身將成為自己的替身。
招式学习器９１,招式學習器９１,将身体的光芒聚集在一点释放出去。有时会降低对手的特防。,將身體的光芒聚集在一個點後釋放出去。有時會降低對手的特防。,將身體的光芒聚集在一點釋放出去。有時會降低對手的特防。
招式学习器９２,招式學習器９２,制造出离奇的空间。在５回合内速度慢的宝可梦可以先行动。,創造出非常不可思議的空間。在５回合內，速度慢的寶可夢可以先行動。,製造出離奇的空間。在５回合內速度慢的寶可夢可以先行動。
秘传学习器０１,秘傳學習器０１,用镰刀或爪子等切斩对手进行攻击。还可以切断细的树木。,用鐮刀或爪子等切斬對手進行攻擊。也可以切斷細的樹木。,用鐮刀或爪子等切斬對手進行攻擊。還可以切斷細的樹木。
秘传学习器０２,秘傳學習器０２,第１回合飞上天空，第２回合攻击对手。还可以飞到去过的城镇。,使用後的第１回合飛上天空，並於第２回合攻擊對手。也可以飛到去過的城鎮。,第１回合飛上天空，第２回合攻擊對手。還可以飛到去過的城鎮。
秘传学习器０３,秘傳學習器０３,利用大浪攻击自己周围所有的宝可梦。,使用大浪攻擊自己周圍所有的寶可夢。也可以在水面上游泳前進。,利用大浪攻擊自己周圍所有的寶可夢。
秘传学习器０４,秘傳學習器０４,使出浑身力气殴打对手进行攻击。还可以推动沉重的岩石。,使出渾身力量毆打對手進行攻擊。也可以推動沉重的岩石。,使出渾身力氣毆打對手進行攻擊。還可以推動沉重的岩石。
秘传学习器０５,秘傳學習器０５,以惊人的气势扑向对手。有时会使对手畏缩。还可以游泳登上瀑布。,以驚人的氣勢撲向對手。有時會使對手畏縮。也可以游泳登上瀑布。,以驚人的氣勢撲向對手。有時會使對手畏縮。還可以游泳登上瀑布。
秘传学习器０６,秘傳學習器０６,用拳头进行攻击。有时会降低对手的防御。还可以击碎岩石。,用拳頭進行攻擊。有時會降低對手的防禦。也可以擊碎岩石。,用拳頭進行攻擊。有時會降低對手的防禦。還可以擊碎岩石。
探险套装,探險組合,装着有助于探险且方便使用的道具的袋子。有了它就可以进入地下通道。,裝著探險時可派上用場的好用道具的袋子。可以進入地下通道。,裝著有助於探險且方便使用的道具的袋子。有了它就可以進入地下通道。
宝物袋,寶物袋,结实的大袋子。可以将在煤矿里获得的宝物放进去。,結實的大袋子。可以將在礦坑裡獲得的寶物放進去。,結實的大袋子。可以將在煤礦裡獲得的寶物放進去。
规则书,規則書,写着对战规则。在进行连接对战时，可以选择规则。,寫著對戰規則。在進行連線對戰時，可以選擇規則。,寫著對戰規則。在進行連接對戰時，可以選擇規則。
宝可追踪,寶可追蹤,能够将藏在草丛里的宝可梦找出来的道具。走路就能给电池充电。,能夠將藏在草叢裡的寶可夢找出來的道具。走路就能給電池充電。,能夠將藏在草叢裡的寶可夢找出來的道具。走路就能給電池充電。
点数卡,點數卡,可以查看赢得的对战点数的卡片。,可以查看贏得的對戰點數的卡片。,可以查看贏得的對戰點數的卡片。
冒险笔记,冒險筆記,记录着到现在为止的冒险经历的笔记。,記錄著到目前為止的冒險歷程的筆記。,記錄著到現在為止的冒險經歷的筆記。
贴纸盒,貼紙盒,放有贴在球壳上的贴纸的容器。,放有貼在球殼上的貼紙的容器。,放有貼在球殼上的貼紙的容器。
饰品盒,飾品盒,漂亮精美的盒子。可以存放宝可梦出演音乐剧时用来装扮自己的多种小物件。,漂亮精美的盒子。可以存放多種用來裝扮出演音樂劇的寶可夢的小飾品。,漂亮精美的盒子。可以存放寶可夢出演音樂劇時用來裝扮自己的多種小物件。
贴纸袋,貼紙袋,可以放入１０张贴纸的小袋子。,可以放入１０張貼紙的小袋子。,可以放入１０張貼紙的小袋子。
朋友手册,朋友手冊,使用方便的手册。可以添加朋友或记录游戏的内容。,好用的手冊。可以新增朋友或記錄遊戲的內容。,使用方便的手冊。可以添加朋友或記錄遊戲的內容。
发电厂钥匙,發電廠鑰匙,用来打开或关闭山谷发电厂大门的大钥匙。不知为何，它落入了银河队的手中。,用來打開或關閉山谷發電廠大門的大鑰匙。不知為何它在銀河隊手中。,用來打開或關閉山谷發電廠大門的大鑰匙。不知為何，它落入了銀河隊的手中。
古代护符,古代護符,要交给神和镇上长老的远古护符。由宝可梦的骨头制成。,要交給神和鎮上長老的遠古護符。由寶可夢的骨頭製成。,要交給神和鎮上長老的遠古護符。由寶可夢的骨頭製成。
银河队钥匙,銀河隊鑰匙,用于解除银河队本部安全防范系统的钥匙卡。弄丢了的话，好像会受到惩罚。,用於解除銀河隊本部保全系統的鑰匙卡。弄丟了的話，好像會受到懲罰。,用於解除銀河隊本部安全防範系統的鑰匙卡。弄丟了的話，好像會受到懲罰。
红色锁链,紅色鎖鏈,神话道具。据说连接着孕育出神奥地区的传说的宝可梦。,神話道具。據說連結著孕育出神奧地區的傳說的寶可夢。,神話道具。據說連接著孕育出神奧地區的傳說的寶可夢。
城镇地图,城鎮地圖,可以随时轻松查看的便利地图。也能清楚自己的位置。,可以隨時輕鬆查看的好用地圖。也能知道自己的位置。,可以隨時輕鬆查看的便利地圖。也能清楚自己的位置。
对战搜寻器,對戰搜尋器,会告诉你想对战的训练家在哪里的机器。走路就能给电池充电。,會告訴你想對戰的訓練家在哪裡的機器。走路就能給電池充電。,會告訴你想對戰的訓練家在哪裡的機器。走路就能給電池充電。
代币盒,代幣盒,可以存放代币的盒子。最多能放入５００００枚在游戏城获得的代币。,最多可以放入５００００枚在遊戲城獲得的代幣的盒子。,可以存放代幣的盒子。最多能放入５００００枚在遊戲城獲得的代幣。
破旧钓竿,破舊釣竿,又破又旧的钓竿。在有水的地方使用的话，可以钓到宝可梦。,又破又舊的釣竿。在有水的地方使用的話，可以釣到寶可夢。,又破又舊的釣竿。在有水的地方使用的話，可以釣到寶可夢。
好钓竿,好釣竿,不错的新钓竿。在有水的地方使用的话，可以钓到宝可梦。,不錯的新釣竿。在有水的地方使用的話，可以釣到寶可夢。,不錯的新釣竿。在有水的地方使用的話，可以釣到寶可夢。
厉害钓竿,厲害釣竿,最新的厉害钓竿。在有水的地方使用的话，可以钓到宝可梦。,最新的厲害釣竿。在有水的地方使用的話，可以釣到寶可夢。,最新的厲害釣竿。在有水的地方使用的話，可以釣到寶可夢。
可达鸭喷壶,可達鴨噴壺,浇水的道具。能让埋在松软土壤里的树果快快长大。,澆水的器具。能讓埋在鬆軟土壤裡的樹果快快長大。,澆水的道具。能讓埋在鬆軟土壤裡的樹果快快長大。
宝芬盒,寶芬盒,用来保存烹饪好的宝芬的容器。,用來存放做好的寶芬的容器。,用來保存烹飪好的寶芬的容器。
自行车,自行車,能比跑步鞋跑得还快的折叠式自行车。,能跑得比跑步鞋還快的折疊式自行車。,能比跑步鞋跑得還快的摺疊式自行車。
房间钥匙,房間鑰匙,湖畔高级宾馆的房间钥匙。不知为何，它经常会丢失。,湖畔高級旅館的房間鑰匙。不知為何老是搞丟。,湖畔高級旅館的房間鑰匙。不知為何，它經常會丟失。
大木的信,大木的信,大木博士的来信。上面写着请来２２４号道路。,來自大木博士的信。上面寫著請來２２４號道路。,大木博士的來信。上面寫著請來２２４號道路。
新月之羽,新月之羽,散发着月辉般光芒的羽毛。据说隐藏着可以驱散恶梦的力量。,散發著月輝般光芒的羽毛。據說隱藏著可以驅除惡夢的力量。,散發著月輝般光芒的羽毛。據說隱藏著可以驅散惡夢的力量。
会员卡,會員卡,可以进入水脉市旅馆的卡片。不知为何，上面刻有５０年前左右的日期。,可以進入水脈市旅館的卡片。不知為何，上面刻有５０年前左右的日期。,可以進入水脈市旅館的卡片。不知為何，上面刻有５０年前左右的日期。
天界之笛,天界之笛,能发出响彻云霄的天籁之音的笛子。不知道是谁在什么时候制造的它。,能發出響徹雲霄的天籟之音的笛子。不知是什麼人在什麼時候製造了它。,能發出響徹雲霄的天籟之音的笛子。不知道是誰在什麼時候製造的它。
船票,船票,乘坐高速船水流号时所需的船票。上面绘有船的图案。,乘坐高速船水流號時所需的船票。上面繪有船的圖案。,乘坐高速船水流號時所需的船票。上面繪有船的圖案。
华丽大赛参加证,華麗大賽參加證,拿着它就可以参加宝可梦华丽大赛。上面印有纪念奖章。,拿著它就可以參加寶可夢華麗大賽。上面印有紀念獎章。,拿著它就可以參加寶可夢華麗大賽。上面印有紀念獎章。
火山镇石,火山鎮石,被灼热熔岩熔化的岩石凝固后形成的产物。里面还留有熔岩。,被灼熱熔岩熔化的岩石凝固後形成的產物。裡面還留有熔岩。,被灼熱熔岩熔化的岩石凝固後形成的產物。裡面還留有熔岩。
包裹,包裹,这是别人托付给你的包裹。需要将它交给从双叶镇启程踏上旅途的青梅竹马。,受人之託要交給從雙葉鎮啟程踏上旅途的青梅竹馬的包裹。,這是別人託付給你的包裹。需要將它交給從雙葉鎮啟程踏上旅途的青梅竹馬。
兑换券１,兌換券１,获取宝可梦手表，简称宝可表时所需的兑换券。需要３张。,欲取得寶可夢手錶，簡稱寶可錶時所需的兌換券。需要３張。,獲取寶可夢手錶，簡稱寶可錶時所需的兌換券。需要３張。
兑换券２,兌換券２,获取宝可梦手表，简称宝可表时所需的兑换券。需要３张。,欲取得寶可夢手錶，簡稱寶可錶時所需的兌換券。需要３張。,獲取寶可夢手錶，簡稱寶可錶時所需的兌換券。需要３張。
兑换券３,兌換券３,获取宝可梦手表，简称宝可表时所需的兑换券。需要３张。,欲取得寶可夢手錶，簡稱寶可錶時所需的兌換券。需要３張。,獲取寶可夢手錶，簡稱寶可錶時所需的兌換券。需要３張。
仓库钥匙,倉庫鑰匙,用于进入银河队在帷幕市市郊的可疑仓库的钥匙。,用於進入銀河隊在帷幕市市郊的可疑倉庫的鑰匙。,用於進入銀河隊在帷幕市市郊的可疑倉庫的鑰匙。
秘传之药,秘傳之藥,在湛蓝市的药店里得到的，能让任何宝可梦立刻变得精力充沛的高效药。,在湛藍市的藥店裡得到的，不管什麼寶可夢都能立刻變得精力充沛的高效藥。,在湛藍市的藥店裡得到的，能讓任何寶可夢立刻變得精力充沛的高效藥。
对战记录器,對戰記錄器,很酷的机器。可以记录和朋友或在特殊设施里的对战过程。,很酷的機器。可以記錄和朋友或在特殊設施裡的對戰過程。,很酷的機器。可以記錄和朋友或在特殊設施裡的對戰過程。
葛拉西蒂亚花,葛拉西蒂亞花,在生日或纪念日等日子里，为了表达感激之情，有时会将其扎成花束送出。,在生日或紀念日等日子裡，為了表達感激之情，有時會將其紮成花束送出。,在生日或紀念日等日子裡，為了表達感激之情，有時會將其紮成花束送出。
秘密钥匙,秘密鑰匙,在特定的地方使用，就会发出特殊电信号来开门的高科技钥匙。,在特定的地方使用，就會發出特殊電子訊號來開門的高科技鑰匙。,在特定的地方使用，就會發出特殊電信號來開門的高科技鑰匙。
球果盒,球果盒,使用方便，可以保存９９个球果的容器。,可以存放９９個球果的好用容器。,使用方便，可以保存９９個球果的容器。
未知图腾笔记,未知圖騰筆記,记录着已找到的未知图腾样子的笔记本。,記錄著已找到的未知圖騰樣子的筆記本。,記錄著已找到的未知圖騰樣子的筆記本。
树果种植盆,樹果種植盆,可以随时轻松培育树果的便携式栽培容器。,可以隨時輕鬆培育樹果的可攜式栽培容器。,可以隨時輕鬆培育樹果的便攜式栽培容器。
探宝器,探寶器,会对看不见的道具起反应，并将它的位置告诉你的最尖端机器。戴在头上使用。,會對看不見的道具起反應，並將它的位置告訴你的最尖端機器。戴在頭上使用。,會對看不見的道具起反應，並將它的位置告訴你的最尖端機器。戴在頭上使用。
蓝卡,藍卡,可以将《葵妍的密语》这节目的点数积攒起来的卡片。,可以將《葵妍的密語》這節目的點數儲存起來的卡片。,可以將《葵妍的密語》這節目的點數積攢起來的卡片。
美味尾巴,美味尾巴,非常美味的某种尾巴。可以在商店高价出售。,非常美味的某種尾巴。可以在商店高價出售。,非常美味的某種尾巴。可以在商店高價出售。
透明铃铛,透明鈴鐺,能发出静心宁神音色的，非常古旧的铃铛。,能發出使人心情平靜音色的，非常古老的鈴鐺。,能發出靜心寧神音色的，非常古舊的鈴鐺。
钥匙卡,鑰匙卡,用来打开电台卷帘门的卡片式钥匙。,用來打開電臺鐵捲門的卡片式鑰匙。,用來打開電台捲簾門的卡片式鑰匙。
地下钥匙,地下鑰匙,用来打开满金地道大门的钥匙。,用來打開滿金地下道的門的鑰匙。,用來打開滿金地下道大門的鑰匙。
杰尼龟喷壶,傑尼龜噴壺,浇水的道具。能让树果种植盆里的树果快快长大。,澆水的器具。能讓樹果種植盆裡的樹果快快長大。,澆水的道具。能讓樹果種植盆裡的樹果快快長大。
红色鳞片,紅色鱗片,在愤怒之湖里出现的红色暴鲤龙的鳞片。散发着像火一样的红色光芒。,在憤怒之湖裡出現的紅色暴鯉龍的鱗片。散發著像火一樣的紅色光芒。,在憤怒之湖裡出現的紅色暴鯉龍的鱗片。散發著像火一樣的紅色光芒。
遗失物,遺失物,模仿少女丢失的魔尼尼人偶。,模仿少女丟失的魔尼尼人偶。,模仿少女丟失的魔尼尼人偶。
磁浮列车自由票,磁浮列車自由票,乘坐磁浮列车时所需的车票。可以随时自由乘坐。,乘坐磁浮列車時所需的車票。可以隨時自由乘坐。,乘坐磁浮列車時所需的車票。可以隨時自由乘坐。
机械零件,機械零件,发电厂里被盗的，用于发电机的重要零件。,被人從發電廠裡偷走的發電機的重要零件。,發電廠裡被盜的，用於發電機的重要零件。
银色之羽,銀色之羽,散发着银色光辉的神奇羽毛。,散發著銀色光輝的神奇羽毛。,散發著銀色光輝的神奇羽毛。
虹色之羽,虹色之羽,散发着虹色光辉的神奇羽毛。,散發著虹色光輝的神奇羽毛。,散發著虹色光輝的神奇羽毛。
神奇蛋,神奇蛋,从宝可梦爷爷那里得到的有着神奇花纹的蛋。不知道是什么的蛋。,從寶可夢爺爺那裡得到的有著神奇花紋的蛋。不知道是什麼的蛋。,從寶可夢爺爺那裡得到的有著神奇花紋的蛋。不知道是什麼的蛋。
红球果,紅球果,红色的球果。有种刺鼻的气味。,紅色的球果。有種刺鼻的氣味。,紅色的球果。有種刺鼻的氣味。
蓝球果,藍球果,蓝色的球果。略有一股青草的香味。,藍色的球果。略有一股青草的香味。,藍色的球果。略有一股青草的香味。
黄球果,黃球果,黄色的球果。有种清爽的香味。,黃色的球果。有種清爽的香味。,黃色的球果。有種清爽的香味。
绿球果,綠球果,绿色的球果。有种焦香的香味，非常神奇。,綠色的球果。有種焦香的香味，非常神奇。,綠色的球果。有種焦香的香味，非常神奇。
粉球果,粉球果,粉红色的球果。有种甜甜的，好闻的香味。,粉紅色的球果。有種甜甜的，好聞的香味。,粉紅色的球果。有種甜甜的，好聞的香味。
白球果,白球果,白色的球果。没有任何气味。,白色的球果。沒有任何氣味。,白色的球果。沒有任何氣味。
黑球果,黑球果,黑色的球果。有种无法形容的气味。,黑色的球果。有種無法形容的氣味。,黑色的球果。有種無法形容的氣味。
速度球,速度球,有点与众不同的球。能很容易地捕捉逃跑速度很快的宝可梦。,有點與眾不同的球。能更容易地捉到逃跑速度很快的寶可夢。,有點與眾不同的球。能很容易地捕捉逃跑速度很快的寶可夢。
等级球,等級球,有点与众不同的球。要捕捉的宝可梦比自己宝可梦的等级越低，就会越容易捕捉。,有點與眾不同的球。對手的等級比自己的寶可夢低越多，就越容易捉到。,有點與眾不同的球。要捕捉的寶可夢比自己寶可夢的等級越低，就會越容易捕捉。
诱饵球,誘餌球,有点与众不同的球。能很容易地捕捉用钓竿钓上来的宝可梦。,有點與眾不同的球。能更容易地捉到用釣竿釣上來的寶可夢。,有點與眾不同的球。能很容易地捕捉用釣竿釣上來的寶可夢。
沉重球,沉重球,有点与众不同的球。能很容易地捕捉身体沉重的宝可梦。,有點與眾不同的球。能更容易地捉到身體沉重的寶可夢。,有點與眾不同的球。能很容易地捕捉身體沉重的寶可夢。
甜蜜球,甜蜜球,有点与众不同的球。能很容易地捕捉和自己宝可梦性别不同的宝可梦。,有點與眾不同的球。能更容易地捉到與自己的寶可夢性別不同的寶可夢。,有點與眾不同的球。能很容易地捕捉和自己寶可夢性別不同的寶可夢。
友友球,友友球,有点与众不同的球。捉到的野生宝可梦会立刻变得和训练家亲密起来。,有點與眾不同的球。捉到的野生寶可夢會立刻和訓練家變得親密。,有點與眾不同的球。捉到的野生寶可夢會立刻變得和訓練家親密起來。
月亮球,月亮球,有点与众不同的球。能很容易地捕捉使用月之石进化的宝可梦。,有點與眾不同的球。能更容易地捉到使用月之石進化的寶可夢。,有點與眾不同的球。能很容易地捕捉使用月之石進化的寶可夢。
竞赛球,競賽球,在捕虫大赛上使用的特殊的球。,在捕蟲大賽上使用的特殊的球。,在捕蟲大賽上使用的特殊的球。
公园球,公園球,在伙伴公园里使用的特殊的球。,在夥伴公園裡使用的特殊的球。,在夥伴公園裡使用的特殊的球。
相册,相簿,用来摆放在冒险中拍摄的纪念相片的相册。,用來擺放在冒險中拍攝的紀念照片的相簿。,用來擺放在冒險中拍攝的紀念相片的相簿。
